<?xml version="1.0" encoding="UTF-8"?>
<!DOCTYPE features_set SYSTEM "feat_set.dtd">
<features_set version="1.1">
	<feature name="Capital Eng alternates" value="Large eng on baseline">
		<value name="Large eng with descender"/>
		<value name="Large eng on baseline"/>
		<value name="Capital N with tail"/>
	</feature>
	<feature name="Literacy alternates" value="True">
		<value name="False"/>
		<value name="True"/>
	</feature>
	<feature name="Barred-bowl forms" value="True">
		<value name="False"/>
		<value name="True"/>
	</feature>
	<feature name="Vietnamese-style diacritics" value="False">
		<value name="False"/>
		<value name="True"/>
	</feature>
	<feature name="Romanian-style diacritics" value="True">
		<value name="False"/>
		<value name="True"/>
	</feature>
	<feature name="Line spacing" value="Imported">
		<value name="Normal"/>
		<value name="Tight"/>
		<value name="Loose"/>
		<value name="Imported"/>
	</feature>
	<imported_line_metrics font="SIL Doulos" em-sqr="1024" metrics="943 225 0 943 225 943 225 0"/>
</features_set>
